{
  "schema": "app2live/1",
  "title": "Fixture",
  "source": {
    "app": "Fixtures",
    "app_version": "1.0.0",
    "platform": "test"
  },
  "tempo": {
    "bpm": 120
  },
  "items": [
    {
      "id": "kick",
      "file": "kick.wav",
      "bytes": 352844,
      "sha256": "37ca3cfb5d8522c2e1abecd50bc7e484c47aa288dcb4b51b466a68264966b1f9",
      "name": "Kick",
      "kind": "loop",
      "role": "drums"
    },
    {
      "id": "kick-2",
      "file": "KICK.wav",
      "bytes": 352844,
      "sha256": "1a68c3debf5ddb8f3aae70ff568a65808ad1e64be654b94ac17d8a5fe8f6e03a",
      "name": "Kick 2",
      "kind": "loop",
      "role": "drums"
    }
  ]
}
